bioproject,name,title,description,doi,abstract
PRJNA140453,Glycine max,Epigenetic Regulation of the Transition from Seed Maturation to Germination in Soybean,"How epigenetics is involved in the transition from seed maturation to seed germination largely remains elusive. To uncover the possible role of epigenetics in gene expression during the transition from seed maturation to seed germination in soybean, the transcriptome of cotyledons from four stages of soybean seed maturation and germination, including mid-late maturation, late maturation, seed dormancy and seed germination, were profiled by Illumina sequencing. For the genes that are quantitatively regulated at the four stages, two antagonistic epigenetic marks, H3K4me3 and H3K27me3, together with the binding of RNA polymerase II, were investigated at the four stages by chromatin immunoprecipitation (ChIP). For 10 out of 16 genes examined, the relative enrichment of histone modification marks (H3K4me3 and H3K27me3) and RNA polymerase II binding on their promoter regions correlates well with their relative expression levels at four stages, suggesting the involvement of epigenetics in transcriptional regulation. A striking finding is that seed germination-specific genes start to show open chromatin (H3K4me3) during late seed maturation although their transcripts do not accumulate, which is further supported by RNA polymerase II binding. Together, our results provide the first evidence that seed germination genes can be primed for transcription (open chromatin and RNA polymerase II binding) during seed maturation, highlighting that the transition from seed maturation to seed germination starts at late seed maturation stages at both the genetic and epigenetic levels. Overall design: Illumina sequencing of transcripts from cotyledons of mid-maturation (B1 stage) and late maturation (AA1 stage) seeds, whole dry seeds, and cotyledons of seedlings six days after imbibition.",29078418,"We profiled soybean and <i>Arabidopsis</i> methylomes from the globular stage through dormancy and germination to understand the role of methylation in seed formation. CHH methylation increases significantly during development throughout the entire seed, targets primarily transposable elements (TEs), is maintained during endoreduplication, and drops precipitously within the germinating seedling. By contrast, no significant global changes in CG- and CHG-context methylation occur during the same developmental period. An <i>Arabidopsis ddcc</i> mutant lacking CHH and CHG methylation does not affect seed development, germination, or major patterns of gene expression, implying that CHH and CHG methylation does not play a significant role in seed development or in regulating seed gene activity. By contrast, over 100 TEs are transcriptionally de-repressed in <i>ddcc</i> seeds, suggesting that the increase in CHH-context methylation may be a failsafe mechanism to reinforce transposon silencing. Many genes encoding important classes of seed proteins, such as storage proteins, oil biosynthesis enzymes, and transcription factors, reside in genomic regions devoid of methylation at any stage of seed development. Many other genes in these classes have similar methylation patterns, whether the genes are active or repressed. Our results suggest that methylation does not play a significant role in regulating large numbers of genes important for programming seed development in both soybean and <i>Arabidopsis.</i> We conclude that understanding the mechanisms controlling seed development will require determining how <i>cis</i>-regulatory elements and their cognate transcription factors are organized in genetic regulatory networks."
PRJNA527732,"The prevalence, evolution and chromatin signatures of plant regulatory elements","The prevalence, evolution and chromatin signatures of plant regulatory elements","Chromatin accessibility and modification is a hallmark of regulatory DNA, which has led to the discovery of cis-regulatory elements (CREs). Here, we characterize chromatin accessibility, histone modifications and sequence conservation in 13 plant species. We identified thousands of putative CREs and revealed that distal CREs are prevalent in plants especially in species with large and complex genomes. The majority of distal CREs have been moved away from their target genes by transposable element (TE) proliferation, but a significant number of distal CREs also appear to be created by TEs. Finally, plant distal CREs are associated with three major types of chromatin signatures that are distinct from metazoans. Taken together, these results suggest that CREs are prevalent in plants, highly dynamic during evolution, and function with distinct chromatin pathways to regulate gene expression.   Overall design: Examination of Chromatin accessibilities, different histone modifications, and expressions in 13 plant species.",31740772,"Chromatin accessibility and modification is a hallmark of regulatory DNA, the study of which led to the discovery of cis-regulatory elements (CREs). Here, we characterize chromatin accessibility, histone modifications and sequence conservation in 13 plant species. We identified thousands of putative CREs and revealed that distal CREs are prevalent in plants, especially in species with large and complex genomes. The majority of distal CREs have been moved away from their target genes by transposable-element (TE) proliferation, but a substantial number of distal CREs also seem to be created by TEs. Finally, plant distal CREs are associated with three major types of chromatin signatures that are distinct from metazoans. Taken together, these results suggest that CREs are prevalent in plants, highly dynamic during evolution and function through distinct chromatin pathways to regulate gene expression."
PRJNA213009,Glycine max,Genes Differentially Expressed in Slow Wilting Phenotypes under a High Vapor Pressure Deficit,"The purpose of this study is to compare transcriptome profiles of one fast wilting and two slow wilting genotypes under low- and high- vapor pressure deficit Experiments: Five differential expression analyses were performed. 1. Differences within the Hutchesen line for slow and fast wilting; 2. Differences within the PI471938 line for slow and fast wilting; 3. Differences within the PI416937 line for slow and fast wilting; Differences between Hutchesen, PI471938 and PI416937 (regardless of pheotype); 5. Comparison between all lines and all pheotypes Methods: RNASeq data was generated using the Illumina HiSeq. Data passing quality control was processed as follows: Alignment to reference genome Gmax_109 using Tophat2 followed by the Tuxedo pipeline (cufflinks, cuffmerge, cuffdiff). Overall design: Three cultivars, (wild-type Hutchesen and two parentla lines - PI471938 and PI416937; two conditions (normal and slow-wilting); two reps each for a total of 12 samples",26427064,"Limiting the transpiration rate (TR) of a plant under high vapor pressure deficit (VPD) has the potential to improve crop yield under drought conditions. The effects of elevated VPD on the expression of genes in the leaves of three soybean accessions, Plant Introduction (PI) 416937, PI 471938 and Hutcheson (PI 518664) were investigated because these accessions have contrasting responses to VPD changes. Hutcheson, a fast-wilting soybean, and PI 471938, a slow-wilting soybean, respond to increased VPD with a linear increase in TR. TR of the slow-wilting PI 416937 is limited when VPD increases to greater than about 2 kPa. The objective of this study was to identify the response of the transcriptome of these accessions to elevated VPD under well-watered conditions and identify responses that are unique to the slow-wilting accessions. Gene expression analysis in leaves of genotypes PI 471938 and Hutcheson showed that 22 and 1 genes, respectively, were differentially expressed under high VPD. In contrast, there were 944 genes differentially expressed in PI 416937 with the same increase in VPD. The increased alteration of the transcriptome of PI 416937 in response to elevated VPD clearly distinguished it from the other slow-wilting PI 471938 and the fast-wilting Hutcheson. The inventory and analysis of differentially expressed genes in PI 416937 in response to VPD is a foundation for further investigation to extend the current understanding of plant hydraulic conductivity in drought environments."
PRJNA409523,Glycine max cultivar:Williams 82,Glycine max Williams 82 Transcriptome - 091-C05 - 730PM,Glycine max Williams 82 RNA sequencing as part of JGI Flagship Plant Gene Atlas project,,
PRJNA629646,Glycine max cultivar:C08,RNAseq of Glycine max inoculated with Sinorhizobium fredii CCBAU45436,"The cultivated soybean C08 was inoculated with Sinorhizobium fredii CCBAU45436. Uninoculated root control, remaining root and nodule were harvested after 28days of inoculation for sequencing.",32987152,"Nitrogen fixation in legumes requires the development of specialized organs called root nodules. Here we characterized the high-confidence transcriptome and genome-wide patterns of H3K4me3 marks in soybean roots and mature nodules symbiotic with Sinorhizobium fredii. Changes in H3K4me3 levels were positively associated with the transcription levels of functional genes in the nodules. The up-regulation of H3K4me3 levels was not only present in leghaemoglobin and nodulin-related genes, but also in genes involved in nitrogen and carbon metabolic pathways. In addition, genes regulating the transmembrane transport of metal ions, phosphates, sulphates, peptides, and sugars were differentially modified. On the contrary, a loss of H3K4me3 marks was found in several key transcription factor genes and was correlated with the down-regulation of the defense-related network in nodules, which could contribute to nodule maintenance. All these findings demonstrate massive reprogramming of gene expressions via alterations in H3K4me3 levels in the genes in mature soybean nodules."
PRJNA432861,The Chinese University of Hong Kong,Cultivated Soybean RNA-Seq of salt treatment,"To obtain a comprehensive understanding of transcriptomic reprogramming under salt stress, we performed whole genome RNA sequencing on salt-treatment soybean seedlings, on two tissues in a time-course experiment (0h, 1h, 2h, 4 h, 24h and 48h). This time series dataset enables us to identify important hubs and connection of gene expressions. We highlighted the analysis of phytohormone signaling pathways and their possible cross-talking. Gene expression regulation also controls adjustment of carbon and nitrogen metabolism. In general, the treated seedlings had turned off the photosynthetic mechanism and enhanced sugar catabolism to provide energy for survival. Primary nitrogen assimilation was shut down while re-distribution of nitrogen resources was activated. Genes for other protective mechanisms were also induced, including structural modification, ion-sequestering, and scavenging of reactive oxygen species.",,
PRJNA692571,Heilongjiang Bayi Agricultural University,The role of soybean under the poison of cadmium ion,"Liaodou 10 under CK anf Cd treated, Shendou20 under CK and Cd treated.",,
PRJNA253461,Glycine max strain:PI399073,Glycine max strain:PI399073 Genome sequencing,"Phytophthora root and stem rot (PRR) caused by Phytophthora sojae Kaufm. &amp; Gerd. is one of the most damaging diseases of soybean and management is principally done by planting cultivars with race-specific resistance (Rps genes). A novel Rps gene was identified in the South Korean landrace PI 399073 and mapped to a region on chromosome 13. The objective of this study was to identify tightly linked molecular markers to facilitate its introduction into high yielding adapted cultivars. Resistance to P. sojae isolate OH25 was evaluated with eight separate Williams (rps8/rps8) x PI 399073 (Rps8/Rps8) populations, of which the phenotypic ratios were highly skewed. In a graphical genotype generated from three Williams x PI 399073 BC4F2 populations, Rps8 and resistance to P. sojae isolate Butmu was associated with a 2.23 Mbp region on chromosome 13. Next generation sequencing was subsequently used to assemble ~90% of the 2.23 Mbp in PI 399073.",,
PRJNA695355,China Agricultural University,Transcriptome or Gene expression,RNA-seq data of soybean during different growth stage.,,
PRJNA612667,Peking University,The asymmetric gene expression analysis in the hypocotyls of soybean (Glycine max) after gravistimulation,"To identify genes that are differentially expressed on the two sides of hypocotyls during the gravitropic response, RNA-seq was performed using the upper and lower sides of dark-grown soybean hypocotyls after gravistimulation. Three-day-old etiolated soybean seedlings were treated with gravitropic stimulation for 0, 1, or 12 h. Gravistimulation was carried out by rotating the plates with vertically grown seedlings. Harvested hypocotyls were separated into two parts, the lower side and the upper side, along the midline. At the indicated timepoints, the two sides of the hypocotyls were collected separately for RNA extraction and sequencing. Two biological replicates for each time point were prepared for RNA-seq analyses. HYDG means the cotyledons facing down and HYUG means the cotyledons facing up.",,
PRJNA448336,Identification of a NAC Transcription Factor for the Elicitation of Glyceollin Biosynthesis in Soybean Reveals a Conserved Phytoalexin Regulatory Pathway,Identification of a NAC Transcription Factor for the Elicitation of Glyceollin Biosynthesis in Soybean Reveals a Conserved Phytoalexin Regulatory Pathway,"Glyceollins are inducible defense metabolites (phytoalexins) that belong to the isoflavonoid family of molecules that are biosynthesized in soybean in response to pathogens and some abiotic stresses. Overall design: Glyceollin metabolite accumulation was elicited in Harosoy63 soybean seedlings that were transferred to germination paper saturated with pH 3.0 medium compared to paper saturated with pH 5.8 medium (control) at 9 days after transfer, whereas seedlings transferred to germination paper that was saturated with pH 5.8 medium then allowed to dry for 6 days (dehydration treatment) had reduced glyceollin metabolite levels compared to the control pH 5.8 filter paper that was continuously saturated with medium (not allowed to dry). Media was half-strength Murashige and Skoog (MS) salts, 1% sucrose, with MS vitamins.",30786857,
PRJDB8696,Glycine max strain:Enrei,Transcriptome analysis of chitin-treated soybeans (Glycine max),"Chitin, an N-acetyl-D-glucosamine polymer, is a component of fungal cell walls and arthropod exoskeletons. This polymer can be used used as a fertilizer or soil amendment to enhance crop growth. However, the polymeric chitin is difficult to handle due to its insolubility in water. We recently developed chitin nanofiber (CNF), which has a highly uniform structure of 10-20 nm thickness and shows high dispersing ability in water. In this study, the transcriptome analysis by RNA-seq was conducted to elucidate global changes in gene expression in shoots and roots of CNF-treated soybeans (Glycine max).",,
PRJDB7011,Glycine max strain:BRS184,Response of Rpp3-NIL to soybean rust,Experimental design: 2 genotypes: Cultivar BRS184 and NIL(Rpp3) containing (Rpp3 resistance gene of FT2) 2 treatments: Soybean rust (Phakopsora pachyrhizi) and mock infection 3 replications 1 time point: 24 hours after inoculation TOTAL: 12 RNA sequencing. Sample: 2nd or 3rd true leaf. Stage: V2. Growth condition: growth chamber with fluorescent light. Day length: 14 light/10 dark. Sampling time: 6 hours after the beginning of light condition.,30290334,"Asian soybean rust (ASR), caused by the obligate biotrophic fungus Phakopsora pachyrhizi, is responsible for severe yield losses of up to 90% in all soybean producing countries. Till today, eight resistance to Phakopsora pachyrhizi (Rpp) loci have been mapped in soybean. Their resistance mechanism is race specific but largely unknown. The transcriptomes of susceptible BRS184 and Rpp3 with ASR isolates T1-2&#x202f;at 24&#x202f;h after inoculation (hai) and without ASR inoculation (mock) were annotated by similarity searching with different databases. A total of 4518 differentially expressed genes were identified. We found 70.89%, 56.61%, 32.13%, and 56.04% genes in the protein family databases (PFAM), Gene Ontology (GO), Eukaryotic clusters of Orthologous Groups (KOG), and Kyoto Encyclopedia of Genes and Genomes Pathway (KEGG), respectively. KEGG disclosed that 52% of the phenylpropanoid pathway related genes were up-regulated. The relative gene expression study for selected genes of that pathway was conducted by RT-qPCR using Rpp1-Rpp4 carrying lines with T1-2 infection. The RT-qPCR results revealed that the Rpp lines utilized these genes in a rate limiting manner as a defence response. With the exception of glycinol 4-dimethylallyltransferase (G4DT) and chalcone reductase (CHR), all the genes showed the greatest expression at 12 hai, but the gene expressions which occur between 24 and 96 hai make these Rpp lines unique to their respective ASR isolates. Moreover, functional coordination of arogenate dehydratase 6 (ADT6) and 4-hydroxy-3-methylbut-2-enyl diphosphate synthase (ispG), chalcone synthase (CHS) and CHR, and G4DT and phytyltransferase 3 (PT3) may have a great impact on soybean resistance against ASR."
PRJNA932613,Northeast Agricultural University,Overexpression of the aldehyde dehydrogenase AhALDH3H1 from Arachis hypogaea in soybean increases saline-alkali stress tolerance,Overexpression of the aldehyde dehydrogenase AhALDH3H1 from Arachis hypogaea in soybean increases saline-alkali stress tolerance,,
PRJNA304631,Glycine max,Genome-wide transcriptome analyses of developing seeds from low and normal phytic acid soybean lines,"Purpose: Comprehensive comparison of gene-expression profiles between 3mlpa (mutant with low phytic acid) and 3MWT (non-mutant with normal phyic acid) soybean lines (Glycine max) at five stages of seed development using RNA-Seq approaches. Methods: mRNA sequencing reads (101SE) were generated in triplicate from five seed developmental stages of 3mlpa and 3MWT soybean line using Illumina HiSeq 2000. Results: A total of 4235 differentially expressed genes, including 512-transcription factor genes were identified. Eighteen biological processes such as apoptosis, glucan metabolism, cellular transport, photosynthesis and 9 transcription factor families including WRKY, CAMTA3 and SNF2 were enriched during seed development. Genes associated with apoptosis, glucan metabolism, and cellular transport showed enhanced expression in early stages of lpa seed development, while those associated with photosynthesis showed decreased expression in late developmental stages. Conclusion: This study provides a global perspective of transcriptomal changes during soybean seed development in 3mlpa mutant. The results suggest that low phtic acid-causing mutations in 3mlpa play a role in inducing and suppressing plant defense responses during early and late stages of seed development, respectively. Overall design: RNA-Seq of five seed developing soybean seeds from mips1/mrp-l/mrp-n triple mutant line (with low phytic acid) and MIPS1/MRP-L/MRP-N non-mutant line (with normal phytic acid). The mRNA libraries from three biological replicates of each sample were sequenced as 101 SE using Illumina HiSeq 2000.",26678836,
PRJNA732533,Glycine max and Vigna unguiculata,Soybean and Cowpea Raw sequence reads,"Leaf samples were collected at four different treatment scenario (Control, Mild drought, Severe drought, and recovery phase) and three time points (6 am, 12 pm, and 16 pm) of a day. For each crop thirty-six (4 treatments x 3 time points x 3 replicates) libraries were constructed for Illumina sequencing. Detailed sample information was mention in the below table.",,
PRJNA410685,Glycine max cultivar:Williams 82,Glycine max Williams 82 Transcriptome - 090-E08 - 730AM,Glycine max Williams 82 RNA sequencing as part of JGI Flagship Plant Gene Atlas project,,
PRJNA539842,Nanjing agriculture university,Transcriptome of soybean ovules and developing seeds,"RNA-Seq data for soybean ovules at the first day of flowering (0 days after flowering, 0 DAF) and developing seeds at 10 DAF, 20 DAF, 30 DAF, 40 DAF.",,
PRJDB8682,"Glycine max strain:GL 3494, OAC Kent, Williams82, Jack",Global gene expression profile of food production grade germinating soybeans,"Gene expression of food-production grade germinating Glycine max (L.) Merr. (soybean) was examined using RNA-seq. Soybean varieties from commercial production (GL 3494, OAC Kent) and bioresource (Williams82, Jack) grades were germinated at 27 Celsius or 40 Celsius, 48 h for comparison. RNA-seq analyses on a single individual seed indicated that the gene expression profile is significantly distant apart when germinated at different temperature as compared with among different soybean varieties. More than 16,430 genes with different expression level (FPKM+1 ratio more than 2 and less than 0.5) were identified between germinating temperatures at 27 Celsius and 40 Celsius, whereas approximately one-tenth (more than 1,595 genes) were found among different soybean varieties.",,
PRJNA449574,Glycine max cultivar:WILLIAM-82,Glycine max cultivar:WILLIAM-82 Raw sequence reads,"To investigate how soybean respond to drought, heat and combined drought and heat",,
PRJNA689050,Glycine max cultivar:Gorgan 3,Glycine max cultivar:Gorgan 3 Transcriptome or Gene expression,Pooled soybean leaf samples showing viral disease symptoms collected from Golestan and Mazandaran provinces in the north of Iran,,
PRJNA1011551,Northeast Agricultural University,Root drought response of two varieties with different drought tolerance,Heinong44 ( drought-resistant ) and Heinong65 ( sensitive ) were selected as experimental materials to study the transcriptome changes of roots under drought stress.,,
PRJNA1033144,Shanxi Agricultural University,Transcriptome analysis of eCO2 alleviating drought stress,Elevating CO2 in soybeans under drought conditions and analyzing its metabolic changes at the transcriptional level,,
PRJNA988177,South China Agricultural University,Root Transcriptome,Root Transcriptome,,
PRJNA867332,Guizhou University,Adaptation mechanism and transcriptomics of soybean to low phosphorus stress analyse,"To study the strategies of different soybean roots in response to low phosphorus stress, and to do further research at the level of transcriptomics, through biological analysis, the aim is to reveal the response of soybean to low phosphorus stress at the level of transcriptomics, clarify the molecular response mechanism of low phosphorus tolerant soybean, lay a foundation for revealing the regulation mechanism of soybean phosphorus metabolism, and have important significance for cultivating new soybean materials and germplasm with low phosphorus tolerance.",,
PRJNA983868,Huazhong Agricultural University,transcriptome,Soybean root Transcriptome,,
