bioproject,name,title,description,doi,abstract
PRJNA1030137,Shenyang Agricultural University,Unraveling Low Phosphorus Response Mechanisms in Salt-Tolerant Soybean Germplasms,"This study focuses on elucidating the response mechanisms of low phosphorus stress in salt-tolerant soybean germplasms. Two soybean varieties, A74 (salt-tolerant and phosphorus-efficient) and A6 (salt-tolerant and phosphorus-inefficient), were chosen as the primary materials. The aim was to investigate how soybeans with different phosphorus efficiencies respond to low phosphorus stress in the presence of salt stress.&lt;/p&gt;&lt;p&gt;The research approach combined physiochemical and transcriptional analysis, resulting in the identification of 14,075 differentially expressed genes through pairwise comparisons. PageMan analysis revealed that A74 exhibited enriched categories related to mitochondrial electron transport, secondary metabolism, stress responses, and miscellaneous functions when compared to A6 under low phosphorus conditions.&lt;/p&gt;&lt;p&gt;Moreover, weighted correlation network analysis unveiled two gene modules highly correlated with acid phosphatase and antioxidant enzyme activity. Within these modules, central hub genes such as citrate synthase, acyl-coenzyme A oxidase4 (ACX), cytokinin dehydrogenase 7 (CXXs), and two-component response regulator ARR2 were identified.&lt;/p&gt;&lt;p&gt;This project aims to provide a deeper understanding of how salt-tolerant soybean germplasms with varying phosphorus efficiencies adapt and respond to low phosphorus stress, shedding light on potential strategies for enhancing crop resilience under challenging environmental conditions.",,
PRJNA727448,Fujian Agriculture and Forestry Universtiy,RNA-SEQ sequencing,"To investigate the molecular mechanism underlying the GmPTF1-mediated regulation of root growth as well as P efficiency, we performed a RNA sequencing (RNA-seq) analysis using wild-type and GmPTF1 overexpressing transgenic plants grown under Pi sufficient (+P) and deficient (-P) conditions",10.1111/tpj.15307,
PRJNA1039334,Northeastern Forestry University,Soybean dry seeds sequencing,Row data of RNA-seq and WGBS in soybean dry seeds. Include 11 wildtype and one mutant,,
PRJNA140081,Glycine max,Genome-Wide Transcript Profiling During Soybean Seed Development and Throughout the Soybean Life Cycle,"We report the genome-wide transcriptome of soybean seeds across several stages of seed development and the entire life cycle using Illumina high-throughput sequencing technology. Specifically, we profiled whole seeds containing globular-stage, heart-stage, cotyledon-stage, early maturation-stage, mid-maturation-stage, and late-maturation-stage embryos. We also profiled dry soybean seeds, and vegetative and reproductive tissues including leaves, roots, stems, seedlings, and floral buds. Overall design: IIllumina sequencing of transcripts from whole seeds at five stages of seed development (globular, heart, cotyledon, early-maturation, mid-maturation, late-maturation, dry), and vegetative (leaves, roots, stems, seedlings) and reproductive (floral buds) tissues.",25963149,"We used an RNA interference screen to assay the function of 53 transcription factor messenger RNAs (mRNAs) that accumulate specifically within soybean (Glycine max) seed regions, subregions, and tissues during development. We show that basic helix-loop-helix (bHLH) transcription factor genes represented by Glyma04g41710 and its paralogs are required for the formation of stoma in leaves and stomatal precursor complexes in mature embryo cotyledons. Phylogenetic analysis indicates that these bHLH transcription factor genes are orthologous to Arabidopsis (Arabidopsis thaliana) SPEECHLESS (SPCH) that initiate asymmetric cell divisions in the leaf protoderm layer and establish stomatal cell lineages. Soybean SPCH (GmSPCH) mRNAs accumulate primarily in embryo, seedling, and leaf epidermal layers. Expression of Glyma04g41710 under the control of the SPCH promoter rescues the Arabidopsis spch mutant, indicating that Glyma04g41710 is a functional ortholog of SPCH. Developing soybean embryos do not form mature stoma, and stomatal differentiation is arrested at the guard mother cell stage. We analyzed the accumulation of GmSPCH mRNAs during soybean seed development and mRNAs orthologous to MUTE, FAMA, and inducer of C-repeat/dehydration responsive element-binding factor expression1/scream2 that are required for stoma formation in Arabidopsis. The mRNA accumulation patterns provide a potential explanation for guard mother cell dormancy in soybean embryos. Our results suggest that variation in the timing of bHLH transcription factor gene expression can explain the diversity of stomatal forms observed during plant development."
PRJNA741780,Henan Agricultural University,RNA-seq of soybean leaves under low phosphorus treatment,Identification of soybean phosphorous efficiency QTLs and genes using chlorophyll fluorescence parameters through GWAS and RNA-seq,,
PRJNA357655,University of Georgia,DNA methylome and transcriptome sequencing of wild and domesticated soybean,"Single-base resolution DNA methylation maps were generated for seven and nine accessions of wild and domesticated soybean, respectively, and compared with the transcriptomes to study the epigenetic and transcriptional fates of genes within and between Glycine species.",,
PRJNA932570,Northeast Agricultural University,Overexpression of peanut (Arachis hypogaea L.)AhALDH2B6 enhances cold resistance in soybean,Overexpression of peanut (Arachis hypogaea L.)AhALDH2B6 enhances cold resistance in soybean,,
PRJNA900526,Guangzhou University,RNA-seq and ChIP-seq,"The ms2 mutant displayed completely male sterility. Map-based cloning uncovered that MS2 encodes a bHLH transcriptional factor. To identify the direct downstream genes of MS2, high throughput sequencing including RNA-seq and ChIP-seq were used.",,
PRJNA648759,Purdue University,mobile RNAs detected in graft soybean/common bean system,"We detected the mobile mRNAs / sRNAs and decipher their functions by integrating sRNA-seq, RNA-seq, and single molecule, real-time (SMRT)-seq, and degradome-seq data from heterografted and autografted soybean (Glycine max) and common bean (Phaseolus vulgaris)",,
PRJNA387303,Glycine max,Gene Expression Changes in the Development of the Soybean Seed Mid-Maturation (B1) Stage,"We investigated soybean seed development because (1) soybean seeds are a major source of food and fuel, (2) soybean seeds have been an excellent system for studying the basic processes controlling seed development for over three decades, and (3) new soybean genomic resources, including the sequence of the soybean genome and the gene expression profiles for all seed compartments, tissues, and cell types, can be used to gain new insights into the regulatory processes required for seed differentiation. We sequenced messenger RNA populations of specific soybean seed compartments, which will provide new insights into gene expression that are important for “making a soybean seed.” Overall design: Three compartments of the mid-maturation (B1) stage of the soybean seeds were analyzed. Three biological replicates were collected for each compartment.",,
PRJNA1062726,Glycine max,Glycine max Raw sequence reads,Normal transcriptome sequencing of soybean,,
PRJNA924064,Glycine max,Glycine max Raw sequence reads,Normal transcriptome sequencing of soybean.,,
PRJNA551573,Glycine max cultivar:Williams 82,Study of regulatory mechanism of GmOLEO1,Compare the seed transcriptomes between OE-GmOLEO1 and its wild type Williams82,,
PRJNA579169,,,,,
PRJNA482945,RNAseq data of two week-old soybean leaves response to cold stress,RNAseq data of two week-old soybean leaves response to cold stress,"Transcriptome analysis of cold-treated leaves (unifoliates) of soybean seedlings were performed. RNAseq analysis was performed using two lanes on a Illumina HiSeq2000 and sequenced on a 100bp, paired-end run. Overall design: Two-weeks old soybean (c.v. ‘Williams 82’) seedlings were cold-treated (4 °C) starting at 4 h after the lights turned on (Zeitgeber Time, ZT4 h, 18 hours light/6 hours dark) and maintaining 4 °C continuously with the light cycle till harvest time (0, 1, and 24 hours). All treatment samples were performed in triplicate (with n≥6 plants per replication).",26993238,"Soybean (Glycine max) is considered to be cold intolerant and is not able to significantly acclimate to cold/freezing stress. In most cold tolerant plants, the C-repeat/DRE Binding Factors (CBF/DREBs) are critical contributors to successful cold-responses; rapidly increasing following cold treatment and regulating the induction of many cold responsive genes. In soybean vegetative tissue, we found strong, transient accumulation of CBF transcripts in response to cold stress; however, the soybean transcripts of typical cold responsive genes (homologues to Arabidopsis genes such as dehydrins, ADH1, RAP2.1, and LEA14) were not significantly altered. Soybean CBFs were found to be functional, as when expressed constitutively in Arabidopsis they increased the levels of AtCOR47 and AtRD29a transcripts and increased freezing tolerance as measured by a decrease in leaf freezing damage and ion leakage. Furthermore the constitutive expression of GmDREB1A;2 and GmDREB1B;1 in Arabidopsis led to stronger up-regulation of downstream genes and more freezing tolerance than GmDREB1A;1, the gene whose transcript is the major contributor to total CBF/DREB1 transcripts in soybean. The inability for the soybean CBFs to significantly up regulate the soybean genes that contribute to cold tolerance is consistent with poor acclimation capability and the cold intolerance of soybean."
PRJNA823397,Glycine max,Glycine max Transcriptome (CK and DPC+DROUGHT),Transcriptome data of two soybean varieties under Mepiquat Chloride stress.DPC stands for drought + dpc,,
PRJNA687319,Northeast Institute of Geography and Agroecology,short petioles and rolled leaves of soybean,Location of related genes of short petioles and rolled leaves in soybean,,
PRJNA907509,Glycine max,Glycine max SNAP RNAseq and ChIPseq,"Legumes can utilize atmospheric nitrogen (N) via symbiotic nitrogen fixation (SNF), which benefits crop production and sustainable agriculture. However, high soil inorganic N can suppress the initiation, growth and function of nodules. So far, how mature nodules respond to high N exposure is poorly understood at the molecular level. We show using co-expression network analysis of transcriptomic data in soybean that high N inhibition of nitrogenase activity and acceleration of senescence is dynamic and reversible. Our study demonstrates that SNAP TFs orchestrate a hierarchical transcriptional cascade in the N-induced transcriptional network in mature nodules.",,
PRJNA238493,Glycine max strain:Williams 82,Glycine max strain:Williams 82 Transcriptome or Gene expression,Soybena 28 Tissues Collected from the Different Developmental Stages for RNA-seq,24681622,"Alternative splicing (AS) is common in higher eukaryotes and plays an important role in gene posttranscriptional regulation. It has been suggested that AS varies dramatically among species, tissues, and duplicated gene families of different sizes. However, the genomic forces that govern AS variation remain poorly understood. Here, through genome-wide identification of AS events in the soybean (Glycine max) genome using high-throughput RNA sequencing of 28 samples from different developmental stages, we found that more than 63% of multiexonic genes underwent AS. More AS events occurred in the younger developmental stages than in the older developmental stages for the same type of tissue, and the four main AS types, exon skipping, intron retention, alternative donor sites, and alternative acceptor sites, exhibited different characteristics. Global computational analysis demonstrated that the variations of AS frequency and AS types were significantly correlated with the changes of gene features and gene transcriptional level. Further investigation suggested that the decrease of AS within the genome-wide duplicated genes were due to the diminution of intron length, exon number, and transcriptional level. Altogether, our study revealed that a large number of genes were alternatively spliced in the soybean genome and that variations in gene structure and transcriptional level may play important roles in regulating AS."
PRJNA561626,Glycine,Platinum-grade reference genomes of multiple soybeans reveal structural variations important for domestication and breeding,Platinum-grade reference genomes of multiple soybeans reveal structural variations important for domestication and breeding,,
PRJNA374025,"United States Department of Agriculture, Agricultural Research Service",Coupling RNA-seq and virus induced gene silencing to identify gene networks regulated by GmMEKK1 in Glycine max,GmMEKK1 silencing was performed in Glycine max (Williams 82) using virus-induced gene silencing (VIGS) mediated by Bean pod mottle virus (BPMV). Rna-Seq was performed to compare the transcriptional profile of GmMEKK1-silenced plants to vector control plants.,,
PRJNA564957,A Transcriptional Regulatory Network of Rsv3-mediated Extreme Resistance Against Soybean Mosaic Virus,A Transcriptional Regulatory Network of Rsv3-mediated Extreme Resistance Against Soybean Mosaic Virus,"Resistance (R) genes are very effective for disease control in plants. Current research shows that R genes predominantly function by inducing a hypersensitive reaction (HR), which results in localized cell death thought to restrict pathogen spread. Some R genes elicit a more atypical response where resistance is not associated with HR or the associated gene expression changes, termed extreme resistance (ER). The molecular regulatory mechanism underlying ER is largely unexplored. One of the few known, naturally occurring, instances of ER is resistance derived from the soybean Rsv3 gene, which confers resistance against the most virulent strains of soybean mosaic virus (SMV). To discern the regulatory mechanism underlying the Rsv3-mediated ER reaction, we generated a gene regulatory network using transcriptomic data from a time course comparison of SMV-G7-infected resistant (L29, Rsv3-genotype) and susceptible (Williams82, rsv3-genotype) soybean cultivars. We identified putative interactions between transcription factors (TFs) regulating gene expression in hormone regulatory pathways, such as abscisic acid (ABA) and jasmonic acid (JA). This is consistent with the demonstrated involvement of these pathways in Rsv3-mediated resistance. We found significant enrichment for the G-box motif (“CACGTG”) among genes implicated in ABA- and JA-related activities. This motif is specifically recognized by MYC2, which is a master regulator of ABA and JA signaling. Our network identified a MYC2 TF encoded by Glyma.07G051500 as a putative transcriptional regulator whose expression was significantly down-regulated in L29. This correlated with the down-regulation of expression of genes involved in ABA and JA processes. Our results suggest an important function for Glyma.07G051500 in ABA and JA derived defense signaling. Additionally, our regulatory network found other putative TFs with differential expression, such as MYBs and ERFs, which may also be involved in regulating ABA and JA signaling for defense. The regulatory network presented here offers new insights into the regulation of the molecular defense mechanism underlying Rsv3-mediated ER against SMV. Overall design: The soybean cultivars ‘L29’ (Rsv3-genotype; resistant) and ‘Williams82’ (rsv3-genotype; susceptible) were used in this study. The Rsv3-genotype confers ER to the most virulent strains of SMV. Thus the goal of this study was to investigate the regulation of the Rsv3-mediated ER molecular defense mechanism against SMV. Plants were grown in controlled greenhouse conditions and inoculated at first, fully, expanded trifoliolate stage with SMV strain G7 (SMV-G7). Unifoliolate leaves were dusted with carborundum powder and rubbed with SMV-G7 inoculum. The inoculated unifoliolate leaves were collected at 0, 2, 4, 6, and 8 hours post inoculation (hpi) and stored at -80°C until RNA extraction. High-quality total RNA (RNA &gt;7.0) was extracted from frozen samples using RNeasy Plant Mini Kit (QIAGEN, Hilden, Germany) with on-column DNase digestion (QIAGEN, Hilden, Germany). A total of 20 mRNA libraries (= 2 cultivars x 5 time-points x 2 biological replicates) were prepared from duplicate RNA samples of each line at each time point and sequenced as 150PE with Illumina HiSeq4000 (Illumina, San Diego, CA) at Novogene, Sacramento, CA.",32315334,"Resistance genes are an effective means for disease control in plants. They predominantly function by inducing a hypersensitive reaction, which results in localized cell death restricting pathogen spread. Some resistance genes elicit an atypical response, termed extreme resistance, where resistance is not associated with a hypersensitive reaction and its standard defense responses. Unlike hypersensitive reaction, the molecular regulatory mechanism(s) underlying extreme resistance is largely unexplored. One of the few known, naturally occurring, instances of extreme resistance is resistance derived from the soybean Rsv3 gene, which confers resistance against the most virulent Soybean mosaic virus strains. To discern the regulatory mechanism underlying Rsv3-mediated extreme resistance, we generated a gene regulatory network using transcriptomic data from time course comparisons of Soybean mosaic virus-G7-inoculated resistant (L29, Rsv3-genotype) and susceptible (Williams82, rsv3-genotype) soybean cultivars. Our results show Rsv3 begins mounting a defense by 6 hpi via a complex phytohormone network, where abscisic acid, cytokinin, jasmonic acid, and salicylic acid pathways are suppressed. We identified putative regulatory interactions between transcription factors and genes in phytohormone regulatory pathways, which is consistent with the demonstrated involvement of these pathways in Rsv3-mediated resistance. One such transcription factor identified as a putative transcriptional regulator was MYC2 encoded by Glyma.07G051500. Known as a master regulator of abscisic acid and jasmonic acid signaling, MYC2 specifically recognizes the G-box motif (""CACGTG""), which was significantly enriched in our data among differentially expressed genes implicated in abscisic acid- and jasmonic acid-related activities. This suggests an important role for Glyma.07G051500 in abscisic acid- and jasmonic acid-derived defense signaling in Rsv3. Resultantly, the findings from our network offer insights into genes and biological pathways underlying the molecular defense mechanism of Rsv3-mediated extreme resistance against Soybean mosaic virus. The computational pipeline used to reconstruct the gene regulatory network in this study is freely available at https://github.com/LiLabAtVT/rsv3-network."
PRJNA259941,Glycine Max,Glycine Max Transcriptome or Gene expression,RNA-seq of two soybean accessions under water deficit,,
PRJNA936646,Gansu Agricultural University,Transcriptional sequencing of stem in soybean,To identify the key genes involved in this process. Transcriptomics analysis was performed.,,
PRJNA479468,Genome wide transcriptome analysis reveals complex regulatory mechanisms underlying phosphate homeostasis in soybean nodules,Genome wide transcriptome analysis reveals complex regulatory mechanisms underlying phosphate homeostasis in soybean nodules,"Phosphorus (P) deficiency is a major limitation for legume crop production. Although overall adaptations of plant roots to P deficiency have been extensively studied, fragmentary information is available in regards to root nodule responses to P deficiency. In this study, genome wide transcriptome analysis was conducted using RNA-seq analysis to investigate molecular mechanisms underlying soybean (Glycine max) nodule adaptation to phosphate (Pi) starvation. Phosphorus deficiency significantly decreased soybean nodule growth and nitrogenase activity. Nodule Pi concentrations declined by 49% in response to P deficiency, but this was well below the 87% and 88% decreases observed in shoots and roots, respectively. Nodule transcript profiling revealed that a total of 2,055 genes exhibited differential expression patterns between Pi sufficient and deficient conditions. A set of DEGs appeared to be involved in maintaining Pi homeostasis in soybean nodules, including 8 Pi transporters (PTs), 8 proteins containing the SYG1/PHO81/XPR1 domain (SPXs), and 16 purple acid phosphatases (PAPs). The results suggest that a complex transcriptional regulatory network participates in soybean nodule adaption to Pi starvation, most notable a Pi signaling pathway specifically involved in maintaining Pi homeostasis in nodules. Overall design: Soybean seedlings were inoculated with rhizobium, then transferred into nutrient solution containing 500 mM KH2PO4 (HP) or 25 mM KH2PO4 (LP). After 25 days, nodules with the size more than 3 mm were collected for mRNA library construction and sequencing. Nodules from two plants were pooled together as one replicate, and three replicates from each P treatment were used for RNA-seq analysis.",30261621,"Phosphorus (P) deficiency is a major limitation for legume crop production. Although overall adaptations of plant roots to P deficiency have been extensively studied, only fragmentary information is available in regard to root nodule responses to P deficiency. In this study, genome wide transcriptome analysis was conducted using RNA-seq analysis in soybean nodules grown under P-sufficient (500 &#x3bc;M KH&#x2082;PO&#x2084;) and P-deficient (25 &#x3bc;M KH&#x2082;PO&#x2084;) conditions to investigate molecular mechanisms underlying soybean (<i>Glycine max</i>) nodule adaptation to phosphate (Pi) starvation. Phosphorus deficiency significantly decreased soybean nodule growth and nitrogenase activity. Nodule Pi concentrations declined by 49% in response to P deficiency, but this was well below the 87% and 88% decreases observed in shoots and roots, respectively. Nodule transcript profiling revealed that a total of 2055 genes exhibited differential expression patterns between Pi sufficient and deficient conditions. A set of (differentially expressed genes) DEGs appeared to be involved in maintaining Pi homeostasis in soybean nodules, including eight <i>Pi transporters</i> (<i>PTs</i>), eight genes coding proteins containing the <i>SYG1/PHO81/XPR1</i> domain (<i>SPXs)</i>, and 16 <i>purple acid phosphatases</i> (<i>PAPs</i>). The results suggest that a complex transcriptional regulatory network participates in soybean nodule adaption to Pi starvation, most notable a Pi signaling pathway, are involved in maintaining Pi homeostasis in nodules."
PRJNA1031779,Shenyang university,Transcriptomic Changes in Soybean Underlying Growth Promotion and Defense Against Cyst Nematode After Bacillus simplex Sneb545 Treatment,"Bacillus simplex Sneb45 is a plant-growth-promoting rhizobacterium that promotes soybean growth and systemic resistance to cyst nematode. To investigate transcriptional changes in soybean roots in response to B. simplex Sneb45 treatment, transcriptome analysis and quantitative real-time PCR were conducted to detect and validate the differentially expressed genes (DEGs). In total, 19,109 DEGs were obtained. After B. simplex Sneb545 treatment, 970 and 1265 genes were up- and down-regulated at 5 days post-inoculation (dpi), respectively, and 142 and 47 genes were up- and down-regulated at 10 dpi, respectively, compared with untreated soybean roots. Functional annotation of DEGs indicated that B. simplex Sneb545 regulated soybean growth and defense against cyst nematode possibly through genes related to auxin, gibberellin, and NB-LRR protein. In addition, GO and KEGG enrichment analyses indicated that the DEGs were enriched in metabolism, signal transduction, and plant-pathogen interaction pathways. Moreover, the auxin and gibberellin contents were lower in B. simplex Sneb545-treated soybean roots than in untreated roots at 5 dpi. B. simplex Sneb545 possibly altered the expression of wound-induced protein and NAC transcription factor to regulate soybean growth and defense against cyst nematode. Our study provided deep insights into the alterations in soybean transcriptome after exposure to B. simplex Sneb45 and a theoretical basis for further exploring molecular functions underlying the biological control activity of B. simplex Sneb545.",,
