bioproject,name,title,description,doi,abstract
PRJNA734138,Harbin Normal University,"Transcriptional profiling of soybean (Glycine max) under alkaline, strigolactone, alkaline and strigolactone stresses","Analysis of 12-day-old soybean seedlings treated with 50 mM NaHCO3, 1 uM strigolactone, 50 mM NaHCO3 and 1 uM strigolactone for 6 h. Results provide insight into the soybean defense response to alkaline stress",,
PRJNA728527,Glycine max,Glycine max Transcriptome or Gene expression,"Cadmium (Cd) is a toxic heavy metal for organisms. It can accumulate in plants and transmit to human bodies via food chain. Soybean supplies us with protein and oil, and is of great economic value worldwide. Cd poses a serious threat to soybean develop-ment, especially for root growth. Some soybean cultivars represent resistant symptoms to Cd-induced root inhibition under Cd stress, however, the genes and potential mechanisms are not fully understood. We optimized RNA-seq to identify the differentially expressed genes (DEGs) in Cd sensitive (KUAI) and tolerant (KAIYU) soybean roots, and compared the DEGs involved in root resistance to Cd stress.",,
PRJNA409517,Glycine max cultivar:Williams 82,Glycine max Williams 82 Transcriptome - 091-F01 - 130AM,Glycine max Williams 82 RNA sequencing as part of JGI Flagship Plant Gene Atlas project,,
PRJNA185753,Glycine max,Mutations in Argonaute5 Illuminate Epistatic Interactions of the K1 and I Loci Leading to Saddle Seed Color Patterns in Glycine max,"The soybean (Glycine max) seed coat has distinctive, genetically programmed patterns of pigmentation and the recessive k1 mutation can epistatically overcome the dominant I and i-i alleles, which inhibit seed color by producing small interfering RNAs (siRNAs) targeting chalcone synthase (CHS) mRNAs. Small RNA sequencing of dissected regions of immature seed coats demonstrated that CHS siRNA levels cause the patterns produced by the i-i and i-k alleles of the I locus, which restrict pigment to the hilum or saddle region of the seed coat, respectively. To identify the K1 locus, we compared RNA-Seq data from dissected regions of two Clark isolines having similar saddle phenotypes mediated by CHS siRNAs but different genotypes (homozygous i-k K1 versus homozygous i-i k1). By examining differentially expressed genes, mapping information, and genome resequencing, we identified a 129-bp deletion in Glyma.11G190900 encoding Argonaute5 (AGO5), a member of the Argonaute family. Amplicon sequencing of several independent saddle pattern mutants from different genetic backgrounds revealed independent lesions affecting AGO5, thus establishing Glyma.11G190900 as the K1 locus. Non-functional AGO5 from k1 alleles leads to altered distributions of CHS siRNAs, thus explaining how the k1 mutation reverses the phenotype of the seed coat regions from yellow to pigmented, even in the presence of the normally dominant I or i-i alleles. Overall design: High-throughput sequencing using Illumina HiSeq 2000 was performed on pigmented and non-pigmented parts of soybean seeds coat separately, with two biological replicates.",28351993,"The soybean (<i>Glycine max</i>) seed coat has distinctive, genetically programmed patterns of pigmentation, and the recessive <i>k1</i> mutation can epistatically overcome the dominant <i>I</i> and <i>i<sup>i</sup></i> alleles, which inhibit seed color by producing small interfering RNAs (siRNAs) targeting <i>chalcone synthase</i> (<i>CHS</i>) mRNAs. Small RNA sequencing of dissected regions of immature seed coats demonstrated that <i>CHS</i> siRNA levels cause the patterns produced by the <i>i<sup>i</sup></i> and <i>i<sup>k</sup></i> alleles of the <i>I</i> locus, which restrict pigment to the hilum or saddle region of the seed coat, respectively. To identify the <i>K1</i> locus, we compared RNA-seq data from dissected regions of two Clark isolines having similar saddle phenotypes mediated by <i>CHS</i> siRNAs but different genotypes (homozygous <i>i<sup>k</sup> K1</i> versus homozygous <i>i<sup>i</sup> k1</i>). By examining differentially expressed genes, mapping information, and genome resequencing, we identified a 129-bp deletion in Glyma.11G190900 encoding Argonaute5 (AGO5), a member of the Argonaute family. Amplicon sequencing of several independent saddle pattern mutants from different genetic backgrounds revealed independent lesions affecting <i>AGO5</i>, thus establishing Glyma.11G190900 as the <i>K1</i> locus. Nonfunctional AGO5 from <i>k1</i> alleles leads to altered distributions of <i>CHS</i> siRNAs, thus explaining how the <i>k1</i> mutation reverses the phenotype of the seed coat regions from yellow to pigmented, even in the presence of the normally dominant <i>I</i> or <i>i<sup>i</sup></i> alleles."
PRJNA479513,"United States Department of Agriculture, Agricultural Research Service",Rpp1 encodes a ULP-NBS-LRR protein that controls immunity to Phakopsora pachyrhizi in soybean,Virus induced gene silencing coupled with RNA-seq was used to identify genes in the Rpp1 signaling network,,
PRJNA907965,Yangzhou University,soybean GmKRP2a gene in soybean hairy root,"Kip-related proteins (KRPs), as inhibitory proteins of cyclin-dependent kinases, are involved in the growth and development of plants by regulating the activity of the CYC-CDK complex to control cell cycle progression.",,
PRJNA1033217,Andong National University,Soybean virome from Bangladesh,investigation of diversity and distribution of plant virus in bean leaf samples,,
PRJNA1089831,Glycine max,Glycine max Raw sequence reads,normal RNA-seq of Glycinemax,,
PRJNA997097,Qingdao Agriculture university,Transcriptomic analysis of soybean exploring the mechanismof action of fluchloraminpyr.,"Fluchloraminopyr is a novel non-selective herbicide developed by KingAgroot Crop Science Co., Ltd. It is efficiency on monocot and dicot weeds, especially on compositae weeds. It causes stem curling, tissue swelling, leaf epinasty, followed by wilting and necrosis in susceptible plants. However, the mechanism of fluchloraminopyr is still ambiguous. This project aimed to explore the mechanism of fluchloraminopyr based on transcriptomic analysis of soybean.",,
PRJNA846361,South China Agricultural University,Transcriptome sequencing of GmMFT mutants.,Transcriptome sequencing of GmMFT mutants.,,
PRJNA1063219,OceanobacilluspicturaeAlleviatesCdstressandpromotesgrowthinsoybeanseedlings,OceanobacilluspicturaeAlleviatesCdstressandpromotesgrowthinsoybeanseedlings,"ThisresearchonOceanobacilluspicturaeprovidesnewinsightsintomitigatingCdstressinsoybeanplants,reducingsoilCdcontent,andpromotingsoybeanseedlingrootgrowth.Italsoidentifiesnovelgenesandmicrobialspeciesrelevanttothemicrobialreductionofsoilheavymetalpollutionandtheresponsemechanismsofsoybeanplantstoheavymetals. Overall design: TheeffectsofOPoncadmiumstresswereinvestigatedinfourdifferenttreatments.",,
PRJNA833532,Glycine max,Glycine max Raw sequence reads,soybean aluminum stress,,
PRJNA236472,Glycine max cultivar:93B15,Glycine max cultivar:93B15 Transcriptome or Gene expression,"The sustainability of soybean growth is being significantly affected by increases in ozone concentration. Current increases in ozone concentrations have decreased soybean yields by ~15-25%. Furthermore, soybean plants differentiate many more floral buds than survive to mature pods. Studies have found that pod set can be as low as 20-40% under normal conditions. Generally, it is assumed that abortion rates can vary based on location in the canopy, source-sink relationship, hormone levels, shade, water status. However, the genetic controls of flower and pod abscission in soybean are largely unknown, and the effects of ozone on flower and pod abscission have not been thoroughly investigated. Due to the negative effects of ozone on yield, it is of critical importance to understand the genetic control behind soybean abortion. The objective of this study is to understand the gene expression patterns underpinning flower and pod abscission rates in soybean exposed to elevated ozone concentrations.",,
PRJDB9752,Glycine max strain:En1282,Rhizobium used a pathogenic like-effector to hijack leguminous nodulation signalling,"To clarify the Nod-factor independent nodulation signaling by the T3SS effector Bel2-5, RNA sequence analysis was performed using soybean En1282 (nfr1-mutant) roots inoculated with Bradyrhizobium elkanii USDA61 (wild-type) and bel2-5 mutant strains (deletion mutant of T3SS effector).",10.1038/s41598-021-81598-6,"Legume plants form a root-nodule symbiosis with rhizobia. This symbiosis establishment generally relies on rhizobium-produced Nod factors (NFs) and their perception by leguminous receptors (NFRs) that trigger nodulation. However, certain rhizobia hijack leguminous nodulation signalling via their type III secretion system, which functions in pathogenic bacteria to deliver effector proteins into host cells. Here, we report that rhizobia use pathogenic-like effectors to hijack legume nodulation signalling. The rhizobial effector Bel2-5 resembles the XopD effector of the plant pathogen Xanthomonas campestris and could induce nitrogen-fixing nodules on soybean nfr mutant. The soybean root transcriptome revealed that Bel2-5 induces expression of cytokinin-related genes, which are important for nodule organogenesis and represses ethylene- and defense-related genes that are deleterious to nodulation. Remarkably, Bel2-5 introduction into a strain unable to nodulate soybean mutant affected in NF perception conferred nodulation ability. Our findings show that rhizobia employ and have customized pathogenic effectors to promote leguminous nodulation signalling."
PRJNA662487,College of Resource and Environmental Science,The effect of different nitrogen concentration treatments on soybean nodulation.,"Sterilized seeds were germinated in sterilized vermiculite. After 7 days, seedlings were inoculated with rhizobia (USDA110, OD600=0.8) for 2 hours prior to transplanting into nutrient solution containing 5000 uM or 50 uM N supplied as nitrate and ammonium (3:1). Nutrient solution pH was checked daily and adjusted to 5.8-6.0 as necessary with H2SO4 or KOH. Plants transferred to hydroponics solution were reared in growth chambers (day/night: 14 h/10 h). Roots were harvested five days after inoculation by combining three seedlings as one biological replicate. At each sampling time point, three biological replicates were harvested and quickly immersed in liquid nitrogen prior to being subjected to total RNA extraction and then RNA-seq analysis.",,
PRJNA436822,Shenyang Agriculture university,Transcriptomic analysis B.simplex-treated and ono-treated soybeans infected and uninfected soybean cyst nematode,Transcriptomic analysis B.simplex induce soybean resistant soybean cyst nematode,,
PRJNA373610,Glycine max cultivar:Williams 82,Gene expression profiling of Glycine max William 82 - GmCO2-c,Gene expression profiling of Soybean (Glycine Max cv. William 82) root hair cells under high CO2 (800ppm),,
PRJNA1012584,Glycine max,RNA-sequencing of soybean mutant and its wild-type,Transcriptome data of soybean mutant and its wild-type soybean with different isoflavone content,,
PRJNA571970,Glycine max,Glycine max Transcriptome or Gene expression,Glycine max Transcriptome sequencing.,,
PRJNA877709,Anhui Agricultural University,RNA of anther samples of high temperature stress treated and control soybean,Unpublished,,
PRJNA393826,root,Differential response of cultivated and wild soybean to F. oxysporum,Our data enabled us to determine the differences in the defense strategies between the cultivated and wild soybean against the pathogen.This information can be used to efficiently utilize the wild soybean germplasm in breeding programs designed to increase disease resistance to F. oxysporum.,,
PRJNA196471,Glycine max,Glycine max Transcriptome or Gene expression,"To provide novel insights into the molecular basis of floral initiation, RNASeq was used to characterize the soybean transcriptome of leaf and micro-dissected shoot apical meristem at different time points after short-day treatment.",,
PRJNA644602,,,,,
PRJNA793175,High-resolution translatome analysis reveals cortical cell programs during early soybean nodulation,High-resolution translatome analysis reveals cortical cell programs during early soybean nodulation,"The TRAP-seq process is dependent on the expression of a cell layer-specific His-FLAG-tagged ribosomal protein L18 (HF-GmRPL 18), which allows for the immunoprecipitation of ribosomes with their corresponding mRNA to produce tissue-specific translatomes (Zanetti et al., 2005; Castro‐Guerrero et al., 2016).To capture events occurring in the cortex during the early stages of infection and initial cortical cell divisions, we inoculated plants and performed a time-course collection of root samples at 72- and 96-hour post inoculation (hpi) followed by TRAP-seq. Immunoblot analysis indicated that an adequate amount of protein was present for immunoprecipitation. To study rhizobial-induced transcriptional changes in the cortex during early nodule development, we identified a soybean promoter (Glyma.18g53890, Figure 1B) expressed exclusively in the cortex cells using LCM (Kerk et al., 2003; Casson et al., 2008) followed by transcriptional analysis. The cortex-specific promoter was used to drive the expression of GmRPL18 in soybean hairy roots. To capture events occurring in the cortex during the early stages of infection and initial cortical cell divisions, we inoculated plants and performed a time-course collection of root samples at 72- and 96-hour post inoculation (hpi) followed by TRAP-seq. Immunoblot analysis indicated that an adequate amount of protein was present for immunoprecipitation (Figure 1C). Taken together, time-course cortex-specific TRAP-seq was established for studying of early nodule development in soybean. Overall design: Examination of 2 different time point (72hpi and 96hpi) samples with or without B.Japonicum treatment using translating ribosome affinity purification (TRAP) followed by RNA sequencing technology",35498680,"Nodule organogenesis in legumes is regulated temporally and spatially through gene networks. Genome-wide transcriptome, proteomic, and metabolomic analyses have been used previously to define the functional role of various plant genes in the nodulation process. However, while significant progress has been made, most of these studies have suffered from tissue dilution since only a few cells/root regions respond to rhizobial infection, with much of the root non-responsive. To partially overcome this issue, we adopted translating ribosome affinity purification (TRAP) to specifically monitor the response of the root cortex to rhizobial inoculation using a cortex-specific promoter. While previous studies have largely focused on the plant response within the root epidermis (e.g., root hairs) or within developing nodules, much less is known about the early responses within the root cortex, such as in relation to the development of the nodule primordium or growth of the infection thread. We focused on identifying genes specifically regulated during early nodule organogenesis using roots inoculated with <i>Bradyrhizobium japonicum</i>. A number of novel nodulation gene candidates were discovered, as well as soybean orthologs of nodulation genes previously reported in other legumes. The differential cortex expression of several genes was confirmed using a promoter-GUS analysis, and RNAi was used to investigate gene function. Notably, a number of differentially regulated genes involved in phytohormone signaling, including auxin, cytokinin, and gibberellic acid (GA), were also discovered, providing deep insight into phytohormone signaling during early nodule development."
PRJNA126469,Glycine max,Transcriptome changes in soybean seeds resulting from RNAi suppression of seed storage proteins,"We report the changes in transcriptome that results from RNAi suppression of 7S and 11S storage protein synthesis in soybean seeds, Proteomic results show that other proteins compensate for the storage protein shortfall. The transcriptome analysis show numerous changes result from suppressing storage proteins but compensating proteins are accumulated without parallel changes in the protein's transcription. Overall design: Total RNA samples prepared from midmaturation wildtype and storage protein RNAi (SP-) soybeans were used to produce cDNA that was subjected to Illumina sequencing. The resulting sequences were assembled and analyzed to characterize the changes in transcriptome that results from suppressing storage protein synthesis/accumulation.",21398260,"The ontogeny of seed structure and the accumulation of seed storage substances is the result of a determinant genetic program. Using RNA interference, the synthesis of soybean (Glycine max) glycinin and conglycinin storage proteins has been suppressed. The storage protein knockdown (SP-) seeds are overtly identical to the wild type, maturing to similar size and weight, and in developmental ontogeny. The SP- seeds rebalance the proteome, maintaining wild-type levels of protein and storage triglycerides. The SP- soybeans were evaluated with systems biology techniques of proteomics, metabolomics, and transcriptomics using both microarray and next-generation sequencing transcript sequencing (RNA-Seq). Proteomic analysis shows that rebalancing of protein content largely results from the selective increase in the accumulation of only a few proteins. The rebalancing of protein composition occurs with small alterations to the seed's transcriptome and metabolome. The selectivity of the rebalancing was further tested by introgressing into the SP- line a green fluorescent protein (GFP) glycinin allele mimic and quantifying the resulting accumulation of GFP. The GFP accumulation was similar to the parental GFP-expressing line, showing that the GFP glycinin gene mimic does not participate in proteome rebalancing. The results show that soybeans make large adjustments to the proteome during seed filling and compensate for the shortage of major proteins with the increased selective accumulation of other proteins that maintains a normal protein content."
PRJNA373634,Glycine max cultivar:Williams 82,Gene expression profiling of Glycine max William 82 - GmSalinity-c,Gene expression profiling of Soybean (Glycine Max cv. William 82) root hair cells under high salinity (60mM Nacl),,
PRJNA596048,Northeast Agricultural University,Circular RNAs sequencing in soybean under cold stress,Research on soybean circRNAs to provide clues regarding the molecular low temperature-responsive mechanisms in soybean.,,
PRJNA376551,P. sojae and soybean,RNA-seq analysis,This study presented the RNA-seq samples of P. sojae infection soybean.,,
PRJNA1105202,Glycine max,Glycine max Raw sequence reads,normal RNA-seq of Glycine max,,
PRJNA977636,Heilongjiang University,Transcriptome analysis of the interaction of R. intraradices with A. calcoaceticus and soybean,Potted soybeans were inoculated with R. intraradices and A. calcoaceticus and root samples were collected at high incidence of root rot in soybeans for transcriptome sequencing to analyze the mechanism of action of R. intraradices and A. calcoaceticus in inducing disease resistance in soybeans,,
PRJNA660896,"Northeast Institute of Geography and Agroecology, Chinese Academy of Sciences",Glycine max ha12 raw sequence reads of RNA,Raw sequence reads of RNA-seq of six HD12s and M18s,,
PRJNA486345,Comparative transcriptome analysis of manganese transportation in different leaves in soybean under manganese stress,Comparative transcriptome analysis of manganese transportation in different leaves in soybean under manganese stress,"Manganese (Mn) stress is known to be a major limitation for development of soybean, and legume crop productivity globally. However, very little information is available on the adaptive mechanisms, particularly in the important legume crop soybean (Glycine Max L.), which enable leaves to respond to high-Mn availability. Thus, to elucidate these mechanisms in soybean leaves at molecular level, we used an RNA sequencing approach to investigate transcriptomes of the leaves under Mn-sufficient and Pi-excessive conditions. Our investigation revealed that more genes showed altered expression patterns in old leaf than in young leaf under Mn excess, suggesting that the Mn excess-more-sensitive old leaf required expression change in a larger number of genes to cope with high-Mn stress than the Mn excess-less-sensitive young leaf. The functional classification of differentially expressed genes (DEGs) was examined to gain an understanding of how leaves respond to Mn stress, caused by soil Mn excess. As a result, more DEGs involved in nodulation, detoxification, nutrient/ion transport, transcriptional factors, key metabolic pathways, Mn remobilization and signalling were found in Mn-excessive induced old leaves than in Mn-excessive induced young leaves. Our findings have enabled the identification of molecular processes that play important roles in the acclimation of leaves to Mn excess, ultimately leading to the development of Mn-efficient soybean suitable for Mn-excessive soils. Overall design: The experiment was started at the onset of the fifth leaf stage when the plants were transferred to solutions with either normal (5 μM) or high (100 μM) Mn (added as MnSO4). The nutrient solutions were renewed every 3 days. There were two treatments that were arranged in a randomized, complete block design with 3 replicates.",,
PRJNA722946,Guangzhou University,Glycine max RNAseq raw sequence reads,"To further identify the downstream targets and signaling pathway of Rsc7-1 in the immune response, a RNA-seq was performed between WT and Rsc7-1 knock out mutant plants.",,
PRJNA850028,University of Maryland Eastern Shore,Perfluorobutanoic acid (PFBA) induces a non-enzymatic stress response in Soybean (Glycine max L. Merr.),"The study investigated phenotypical, biochemical and transcriptomic responses of soybean plants exposed to environmentally relevant and high concentrations of perfluorobutanoic acid (PFBA) via irrigation water from seed until 5 weeks.",,
PRJNA1091884,Glycine max,Glycine max Raw sequence reads,Normal RNA-seq of soybean roots under soybean cyst nematode,,
PRJNA288056,Glycine max cultivar:Daewon,Glycine max cultivar:Daewon Transcriptome or Gene expression,RNA-seq was performed to reveal differential gene expression. we used two Korean soybean cultivar: Daewon and Hwangkeum.,,
PRJNA1040754,Sichuan Agricultural University,Soybean flower RNA-seq under different intercropping system,"To identify the shade effect on soybean reproductive processes in intercropping, we measured the flowering process, biomass, hormone concentrations, and transcriptomic responses of soybeans subjected to a combination of cultivars and planting systems.",,
PRJNA409473,Glycine max cultivar:Williams 82,Glycine max Williams 82 Transcriptome - 091-A05 - 330PM,Glycine max Williams 82 RNA sequencing as part of JGI Flagship Plant Gene Atlas project,,
PRJNA818822,,,,,
PRJNA223414,Glycine max strain:Clark,Glycine max Transcriptome or Gene expression,"RNAseq was used to compare gene expression in soybean grown in iron sufficient and deficient conditions, one and six hours after transfer into iron stress conditions",,
PRJNA495327,Soybean and rhizobium,the symbiosis system between soybean and rhozobium,"this project is for soybean nodulation, a kind of symbiosis system, containing soybean root tissue, nodule tissue and rhizobium (Bradyrhizobium japonicum USDA110) free living sample. Genome sequencing and assembly",31346137,"Rhizobial infection and root nodule formation in legumes require recognition of signal molecules produced by the bacteria and their hosts. Here, we show that rhizobial transfer RNA (tRNA)-derived small RNA fragments (tRFs) are signal molecules that modulate host nodulation. Three families of rhizobial tRFs were confirmed to regulate host genes associated with nodule initiation and development through hijacking the host RNA-interference machinery that involves ARGONAUTE 1. Silencing individual tRFs with the use of short tandem target mimics or by overexpressing their targets represses root hair curling and nodule formation, whereas repressing these targets with artificial microRNAs identical to the respective tRFs or mutating these targets with CRISPR-Cas9 promotes nodulation. Our findings thus uncover a bacterial small RNA-mediated mechanism for prokaryote-eukaryote interaction and may pave the way for enhancing nodulation efficiency in legumes."
PRJNA818823,Glycine max,Glycine max Transcriptome or Gene expression,Transcriptome analysis of leaves in overexpressed and knockout lines of soybean GmFtsH25,,
