bioproject,name,title,description,doi,abstract
PRJDB10183,Glycine max,RNA sequencing of fungal-fermented soybean,"Flavonoids are an important class of plant specialized metabolites. They have various biological functions, including antioxidant action and interaction with other organisms. For example, daidzein and genistein are required for symbiosis with rhizobia, and daidzein is a precursor of glyceollin. Previous studies showed that isoflavonoids were increased by the inoculation of fungi in soybean. However, transcriptomic and metabolomic change by fungal inoculation has not yet been investigated. In this study, we investigated the metabolic response of fungal-fermented soybean seedlings at the transcriptome and metabolome levels.",32894761,"Isoflavonoids are commonly found in leguminous plants. Glycitein is one of the isoflavones produced by soybean. The genes encoding the enzymes in the isoflavone biosynthetic pathway have mostly been identified and characterized. However, the gene(s) for isoflavone O-methyltransferase (IOMT), which catalyzes the last step of glycitein biosynthesis, has not yet been identified. In this study, we conducted multi-omics analyses of fungal-inoculated soybean and indicated that glycitein biosynthesis was induced in response to biotic stress. Moreover, we identified a unique type of IOMT, which participates in glycitein biosynthesis. Soybean seedlings were inoculated with Aspergillus oryzae or Rhizopus oligosporus and sampled daily for 8&#x2009;d. Multi-omics analyses were conducted using liquid chromatography-tandem mass spectrometry and RNA sequencing. Metabolome analysis revealed that glycitein derivatives increased following fungal inoculation. Transcriptome co-expression analysis identified two candidate IOMTs that were co-expressed with the gene encoding flavonoid 6-hydroxylase (F6H), the key enzyme in glycitein biosynthesis. The enzymatic assay of the two IOMTs using respective recombinant proteins showed that one IOMT, named as GmIOMT1, produced glycitein. Unlike other IOMTs, GmIOMT1 belongs to the cation-dependent OMT family and exhibited the highest activity with Zn2+ among cations tested. Moreover, we demonstrated that GmIOMT1 overexpression increased the levels of glycitein derivatives in soybean hairy roots when F6H was co-expressed. These results strongly suggest that GmIOMT1 participates in inducing glycitein biosynthesis in response to biotic stress."
PRJNA881271,Inner Mongolia Academy of Agricultural &amp; Animal Husbandry Sciences,Transcriptome analysis of soybean roots in response to boron deficiency,"Boron (B) is an essential micronutrient essential for normal plant normal growth and development. B deficiency is detrimental to Glycine max (L.) Merr., which is one of the leading oil-crops. species, is extremely susceptible to B deficiency. In this study, the physiological analysis of soybean seedlings under B deficiency (T1, T2, T3, T4) and control (CK1, CK2, CK3, CK4) after 12 h, 24 h, 72 h, and 8 d was carried out, and the roots were subjected to transcriptome sequencing analysis. The results showed that under B deficiency, the plant height, SPAD, and chlorophyll fluorescence value (Fv/Fm) of soybean seedlings decreased significantly, indicating that B stresses significantly inhibited plant growth and photosynthesis. After RNA-seq sequencing, showed a total of 5126 DEGs (Differentially Expressed Genes) were obtained, including 953 DEGs at 12 h, 760 DEGs at 24 h, 1945 DEGs at 72 h and 1468 DEGs at 8 d. There were 9Nine DEGs co-existed at the four-time treatmentspoints, among which GLYMA_03G130600 regulated regulates transcription factor ORG3, which was is related to plant growth. GO analysis showed thatrevealed a total of annotated 8763 DEGs were annotated, among which the terms plasma membrane, extracellular, enzyme activity, ion transport metabolic process and oxidoreductase activity were significantly enriched at the four -time treatmentspoints, which might hinder the growth of soybean and accelerate senescence. KEGG analysis showed that at level 1, the DEGs were mainly enriched in photosynthesis-related, phenylpropanoid biosynthesis, nitrogen metabolism, and plant hormone signal transduction. At level 2 of secondary metabolism, the DEGs were mainly enriched in energy metabolism and amino acid metabolism pathways, which indicates that B stresses mainly affect photosynthesis, hormone regulation and amino acid metabolism of soybean, thus affecting plant growth. Through The above results, give deeper more comprehensive insights into the soybean response to B deficiency would be focused and lay a the foundation for the further studies of the molecular mechanism of soybean response to boron deficiency.",,
PRJNA478334,,,,,
PRJNA464061,Epigenomics of Glycine max,Epigenomics of Glycine max,"Cytosine methylation is a base modification that is often used by genomes to store information that is stably inherited through mitotic cell divisions. Most cytosine DNA methylation is stable throughout different cell types or by exposure to different environmental conditions in plant genomes. Here, we profile the epigenomes of ~100 Glycine max lines to explore the extent of natural epigenomic variation. We also use these data to determine the extent to which DNA methylation variants are linked to genetic variations. Overall design: 100 MethylC-seq, 102 RNA-seq, 102 small RNA-seq of Glycine max.",,
PRJNA999924,soybean,Study on chilling tolerance of soybean during germination,Study on gene co-expression network and key genes related to chilling tolerance of soybean during germination,,
PRJNA1121049,Northeast Agricultural University,Soybean transcriptome sequencing data,Transcriptome sequencing raw data of extreme materials from soybean chromosome segment substitution lines,,
PRJNA648781,Nanjing Agricultural University,Single Nucleotide Polymorphisms database of RIL YHSBLP,"Single Nucleotide Polymorphisms dataset of the 573 soybean accessions selected from the Panel named YHSBLP obtained from National Center for Soybean Improvement, Nanjing Agricultural University (NAU), Nanjing-China. It was used for analysis in the paper entitled: Identification of Quantitative Trait Nucleotides and Candidate Genes for Soybean Seed Weight by Multiple Models of Genome-wide Association Study",,
PRJNA599357,Soybean Expression Atlas in Reproductive Organ Development,Soybean Expression Atlas in Reproductive Organ Development,"In cereal crop plants, sexual development and reproduction are key steps in producing seeds. However, genes responsible for reproductive function and development are largely unknown in soybean. Here, the soybean flower development was divided into three stages, namely the early stage(E), before pollination (BP) and post-pollination (PP). The flowers were hand-dissected into six tissues under the stereomicroscope, including anther (An), filament (Fi), stigma (St), style and ovary (SO), petal (Pe) and sepal (Se). All samples were processed for total RNA extraction and RNA sequencing (RNA-seq) data were generated in this study. Overall design: The soybean reproductive organ mRNA profiles of Williams 82 were generated by deep sequencing, in triplicate, using Illumina Nova Seq.",,
PRJNA776648,Glycine max,Expression analysis of reciprocal grafted of near-isogenic soybean lines under iron stress,"Iron stress response signaling between roots and shoots is not well understood in soybean. While studies have identified early responses to iron stress (as early as 30 minutes) the signaling pathway has not been well documented. In this study we used near-isogenic lines (Clark [Clk] and IsoClark [Iso]) to create four types of grafts (scion/roots), two homografts (Clk/Clk and Iso/Iso) and two heterografts (Clk/Iso and Iso/Clk). In hydroponics we subjected half the grafted seedlings to iron stress and collected leaf and root tissue after 30 and 120 minutes after iron stress; we extracted and sequenced RNA from the tissue samples. We identified differentially expressed genes and differences in expression patterns between grafting combinations. These results support the hypothesis that the physiological and molecular iron stress response is determined by the root genotype.",,
PRJNA802889,Hiroshima University,"A Low-Phytate Soybean Line Disturbs Seed Development-Dependent mRNA Splicing in the Phytate synthesis gene inositol-1,3,4 trisphosphate 5/6-kinase (GmITPK3)","Low-phytate (LP) crops may improve the mineral bioavailability in monogastric animals, which will serve to decrease phosphate pollution. Recently, we reported a newly developed LP soybean line with normal emergence, growth, and yield when compared to the Natto-kotsubu (Natto) cultivar. The RNA-Seq was used to investigate the mechanism underlying reduction in phytic acid levels without impact to physiological characteristics in this LP line. an intron retention (IR) event was detected in inositol-1,3,4 trisphosphate 5/6-kinase 3 (GmITPK3) in LP leaves compared to the reference transcriptome and 34 % of the isoform belonged to an IR isoform. The PCR amplification results showed the LP line produced abundant IR transcripts (IRTs) compared to Natto cultivar and NP line. The predicted amino acid (AA) of IR may have no function compared to the non-intron retention transcript (nIRT). The abundance of each IRTs was changed during seeds development may maintain the phytic acid level in Natto cultivar, however, the abundant of IRTs produced in LP line may perturb the phosphorylation of InsP4 to InsP5 and/or create a negative feedback effect on InsP4 and InsP3 synthesis, leading to reduced phytic acid levels in the LP line during seed development. Hence, the GmITPK3 mutant might involve the decrease the level of phytic acid in seeds without harming the plants, thus representing a new strategy for LP crop development.",,
PRJNA910939,Northeast Agricultural University,547 soybean accessions resequencing data,"Resequencing data of 547 soybean accessions, these were mainly originated from northeast part of China.",10.1111/pbi.14222,"Soybean is one of the most economically important crops worldwide and an important source of unsaturated fatty acids and protein for the human diet. Consumer demand for healthy fats and oils is increasing, and the global demand for vegetable oil is expected to double by 2050. Identification of key genes that regulate seed fatty acid content can facilitate molecular breeding of high-quality soybean varieties with enhanced fatty acid profiles. Here, we analysed the genetic architecture underlying variations in soybean seed fatty acid content using 547 accessions, including mainly landraces and cultivars from northeastern China. Through fatty acid profiling, genome re-sequencing, population genomics analyses, and GWAS, we identified a SEIPIN homologue at the FA9 locus as an important contributor to seed fatty acid content. Transgenic and multiomics analyses confirmed that FA9 was a key regulator of seed fatty acid content with pleiotropic effects on seed protein and seed size. We identified two major FA9 haplotypes in 1295 resequenced soybean accessions and assessed their phenotypic effects in a field planting of 424 accessions. Soybean accessions carrying FA9<sup>H2</sup> had significantly higher total fatty acid contents and lower protein contents than those carrying FA9<sup>H1</sup> . FA9<sup>H2</sup> was absent in wild soybeans but present in 13% of landraces and 26% of cultivars, suggesting that it may have been selected during soybean post-domestication improvement. FA9 therefore represents a useful genetic resource for molecular breeding of high-quality soybean varieties with specific seed storage profiles."
PRJNA674706,Glycine max cultivar:Wm 82,Raw sequence reads of RNA-seq in Glycine max,Researchers should communicate with the provider (cjdxguozilong@163.com) in advance to get authorization for downloading and using the data.,,
PRJNA482870,Network Landscape of Photothermal Flowering in Soybean.,Network Landscape of Photothermal Flowering in Soybean.,The project aims at elucidation of global gene expression patterns underlying photothermal flowering of soybean to clarify the molecular mechanisms of photothermal flowering in soybean. Overall design: RNA-sequencing was conducted using five soybean varieties under different photoperiod and ambient temperature conditions.,,
PRJNA757744,"Host and pathogen gene expression during early infection of soybean seedlings by Phytophthora sojae, analyzed by ABI Solid RNA sequencing","Host and pathogen gene expression during early infection of soybean seedlings by Phytophthora sojae, analyzed by ABI Solid RNA sequencing","Hypocotyls of soybean (Glycine max) seedlings of cultivar Williams were inoculated with mycelia of the oomycete pathogen Phytophthora sojae grown in liquid V8 medium or the hypocotyls were mock inoculated. After 12 hours, the sites of inoculation were excised from the hypocotyls and frozen for RNA extraction. Phytophthora sojae mycelia used for inoculation was saved for RNA extraction also Overall design: Four replicate experiments were conducted. Each replicate consisted of 30 P. sojae-inoculated or mock-inoculated hypocotyls, as well as a sample of the P. sojae mycelia used for the 30 inoculations",34691104,"<i>Phytophthora sojae</i> is an oomycete that causes stem and root rot disease in soybean. <i>P. sojae</i> delivers many RxLR effector proteins, including Avr1b, into host cells to promote infection. We show here that Avr1b interacts with the soybean U-box protein, GmPUB1-1, in yeast two-hybrid, pull down, and bimolecular fluorescence complementation (BIFC) assays. <i>GmPUB1-1</i>, and a homeologous copy <i>GmPUB1-2</i>, are induced by infection and encode 403 amino acid proteins with U-Box domains at their N-termini. Non-synonymous mutations in the Avr1b C-terminus that abolish suppression of cell death also abolished the interaction of Avr1b with GmPUB1-1, while deletion of the GmPUB1-1 C-terminus, but not the U box, abolished the interaction. BIFC experiments suggested that the GmPUB1-1-Avr1b complex is targeted to the nucleus. <i>In vitro</i> ubiquitination assays demonstrated that GmPUB1-1 possesses E3 ligase activity. Silencing of the <i>GmPUB1</i> genes in soybean cotyledons resulted in loss of recognition of Avr1b by gene products encoded by <i>Rps1</i>-b and <i>Rps1</i>-k. The recognition of Avr1k (which did not interact with GmPUB1-1) by <i>Rps1</i>-k plants was not, however, affected following <i>GmPUB1</i>-<i>1</i> silencing. Furthermore, over-expression of GmPUB1-1 in particle bombardment experiments triggered cell death suggesting that GmPUB1 may be a positive regulator of effector-triggered immunity. In a yeast two-hybrid system, GmPUB1-1 also interacted with a number of other RxLR effectors including Avr1d, while Avr1b and Avr1d interacted with a number of other infection-induced GmPUB proteins, suggesting that the pathogen uses a multiplex of interactions of RxLR effectors with GmPUB proteins to modulate host immunity."
PRJNA731151,Glycine max,Identification of plant viruses in soybean by metagenomic sequencing,"Viruses negatively impact soybean production by causing disease that affect yield and seed quality. Newly emerging or re-emerging viruses can also threaten soybean production, because current control measures may not be effective against them. Furthermore, detection and characterization of new plant viruses requires major efforts when no sequence or antibody-based resources are available. In this study, soybean fields were scouted for virus-like disease symptoms during 2018 and 2019 growing seasons. Total RNA was extracted from symptomatic soybean tissues collected individually. cDNA libraries were prepared and RNA sequencing was performed using next-generation sequencing (NGS) Illumina HiSeq3000 (Illumina, https://www.illumina.com/) to generate paired-end reads (HiSeq: 2 * 150 bp, 2 lanes). After removal of soybean reads, the short-reads were de novo assembled using the Trinity assembler. Through metagenomics approaches, several viruses were detected and identified as single or mixed infections in soybean. De novo assemblies generated full- or nearly full-length genomes in soybean. Taken together, the results of this study showed that NGS-based technology is a valuable diagnostic tool for the identification of several viruses in field-grown soybean, and can provide rapid information about plant viruses that were previously not detected in soybean fields.",36100874,
PRJNA635449,Institute of Crop Science,Transcriptomal dissection of universal circadian rhythm in two soybean cultivars with different J/GmELF3 alleles,To analyze the circadian rhythm of gene expression in two soybean cultivars with different J/GmELF3 alleles,,
PRJNA432760,Glycine max,Glycine max Genome sequencing,"On the basis of whole genome methylome data of 45 soybean accessions, we detected the DNA methylation selection regions during soybean domestication and improvement. Combing the re-sequence, smRNA-seq, RNA-seq datasets for the same accessions, we further dissected the relationship between DNA methylation selection regions and genetic variations.",,
PRJNA751136,Yan'an University,Transcriptomic analyis reveals GSH-deficiency of G.max impaired development of Heterodera glycines,"The development of Heterodera glycines(SCN, soybean cyst nematode) were affected G.max under GSH-deficiency condition. For understanding the mechanism of low content of GSH could inhibitor the development of SCN, the transcriptome analysis were performed. Three time-points(5,10, and 15day post infection) were examined and sequencing vis NGS.",,
PRJNA531615,"Treanscriptomes of emering nodules, mature nodules, emerging lateral roots, and young lateral roots in soybean","Treanscriptomes of emering nodules, mature nodules, emerging lateral roots, and young lateral roots in soybean","Symbiotic legume nodules and lateral roots arise away from the root meristem via dedifferentiation events. While these organs share some morphological and developmental similarities, whether legume nodules are modified lateral roots is an open question. We dissected emerging nodules (EN), mature nodules (MN), emerging lateral roots (ELR) and young lateral roots (YLR), and constructed strand-specific RNAseq libraries using polyA-enriched RNA preparations. Root sections above and below these organs devoid of any lateral organs were used to construct respective control tissue libraries (ABEN, ABMN, ABELR, ABYLR respectively). High sequence quality, predominant mapping to coding sequences, and consistency between replicates indicated that the RNAseq libraries were of very high quality. We identified genes enriched in emerging nodules, mature nodules, emerging lateral roots and young lateral roots in soybean by comparing global gene expression profiles between each of these organs and adjacent root segments. Potential uses for this high quality transcriptome data set include generation of global gene regulatory networks to identify key regulators; metabolic pathway analyses and comparative analysis of key gene families to discover organ-specific biological processes; and identification of organ-specific alternate spliced transcripts. When combined with other similar datasets especially from leguminous plants these analyses can help answer questions on the evolutionary origins of root nodules and relationships between the development of different plant lateral organs. Overall design: Three replicate samples were harvested for each of the eight tissue types for the preparation of twenty four RNAseq libraries.",,
PRJNA506905,Genes induced by senescence in soybean,Genes induced by senescence in soybean,Comparison between two vegetative stages of the soybean cultivar BR16: 20 and 80 days after germination (DAG) Overall design: Examination of 2 vegetative stages: 20 and 80 DAGs,30619426,"The <i>NAC</i> (NAM, ATAF, and CUC) genes encode transcription factors involved with the control of plant morph-physiology and stress responses. The release of the last soybean <i>(Glycine max)</i> genome assembly (Wm82.a2.v1) raised the possibility that new NAC genes would be present in the soybean genome. Here, we interrogated the last version of the soybean genome against a conserved NAC domain structure. Our analysis identified 32 putative novel NAC genes, updating the superfamily to 180 gene members. We also organized the genes in 15 phylogenetic subfamilies, which showed a perfect correlation among sequence conservation, expression profile, and function of orthologous <i>Arabidopsis thaliana</i> genes and NAC soybean genes. To validate our <i>in silico</i> analyses, we monitored the stress-mediated gene expression profiles of eight new NAC-genes by qRT-PCR and monitored the GmNAC senescence-associated genes by RNA-seq. Among ER stress, osmotic stress and salicylic acid treatment, all the novel tested GmNAC genes responded to at least one type of stress, displaying a complex expression profile under different kinetics and extension of the response. Furthermore, we showed that 40% of the GmNACs were differentially regulated by natural leaf senescence, including eight (8) newly identified GmNACs. The developmental and stress-responsive expression profiles of the novel NAC genes fitted perfectly with their phylogenetic subfamily. Finally, we examined two uncharacterized senescence-associated proteins, GmNAC065 and GmNAC085, and a novel, previously unidentified, NAC protein, GmNAC177, and showed that they are nuclear localized, and except for GmNAC065, they display transactivation activity in yeast. Consistent with a role in leaf senescence, transient expression of GmNAC065 and GmNAC085 induces the appearance of hallmarks of leaf senescence, including chlorophyll loss, leaf yellowing, lipid peroxidation and accumulation of H<sub>2</sub>O<sub>2</sub>. GmNAC177 was clustered to an uncharacterized subfamily but in close proximity to the TIP subfamily. Accordingly, it was rapidly induced by ER stress and by salicylic acid under late kinetic response and promoted cell death <i>in planta</i>. Collectively, our data further substantiated the notion that the GmNAC genes display functional and expression profiles consistent with their phylogenetic relatedness and established a complete framework of the soybean NAC superfamily as a foundation for future analyses."
PRJNA800609,Zhejiang Academy of Agricultural Sciences,transcriptomics analysis of soybean in response to Colletotrichum truncatum infection,"To explore the molecular mechanisms of resistance in the soybean to anthracnosea, a transcriptomic analysis of pods from two soybean lines, Zhechun No. 3 and ZC-2, in response to Colletotrichum truncatum infection was conducted.",,
